{
  "$schema": "../../schemas/edit.schema.json",
  "version": 1,
  "id": "sample-long-shift",
  "kind": "long",
  "format": "16:9",
  "fps": 30,
  "languages": [
    "en"
  ],
  "title": "One night shift with Aiko",
  "source": {
    "stem": "bot shift (sample)",
    "moments": [
      1,
      2,
      3,
      4,
      5,
      6
    ],
    "notes": "Phase 5 sample: a two-minute long video."
  },
  "scenes": [
    {
      "id": "title",
      "duration": 5,
      "visual": {
        "type": "color",
        "color": "ink"
      },
      "overlays": [
        {
          "type": "label",
          "text": "SHIFT 3",
          "x": 0.5,
          "y": 0.4,
          "style": "crimson",
          "size": "l"
        },
        {
          "type": "label",
          "text": "One night. One manager who *never* stops learning.",
          "x": 0.5,
          "y": 0.56,
          "style": "paper",
          "size": "m",
          "from": 0.8
        },
        {
          "type": "lottie",
          "src": "assets/lottie/sample-pulse.json",
          "x": 0.5,
          "y": 0.4,
          "width": 0.34,
          "enter": "fade"
        }
      ]
    },
    {
      "id": "learned",
      "duration": 18,
      "transition": {
        "type": "fade",
        "duration": 0.6
      },
      "visual": {
        "type": "shot",
        "src": "shots/sample/h_m4_chase.mp4",
        "trim": 1
      },
      "overlays": [
        {
          "type": "lowerThird",
          "title": "She *learned* my route",
          "subtitle": "Moment 4 · the PA calls, then she's there",
          "from": 1,
          "to": 7
        }
      ]
    },
    {
      "id": "blink",
      "duration": 12,
      "transition": {
        "type": "slide",
        "duration": 0.5,
        "direction": "from-right"
      },
      "visual": {
        "type": "shot",
        "src": "shots/sample/h_m3_cctv.mp4",
        "trim": 0,
        "speed": [
          {
            "at": 0,
            "rate": 1
          },
          {
            "at": 4,
            "rate": 0.5
          },
          {
            "at": 8,
            "rate": 1
          }
        ],
        "zoom": [
          {
            "at": 3,
            "scale": 1
          },
          {
            "at": 5,
            "scale": 1.3,
            "x": 0.55,
            "y": 0.5
          },
          {
            "at": 9,
            "scale": 1.3,
            "x": 0.55,
            "y": 0.5
          },
          {
            "at": 11,
            "scale": 1
          }
        ]
      },
      "overlays": [
        {
          "type": "label",
          "text": "CAM 02",
          "x": 0.08,
          "y": 0.08,
          "style": "ink",
          "size": "s"
        },
        {
          "type": "arrow",
          "from_x": 0.25,
          "from_y": 0.25,
          "to_x": 0.5,
          "to_y": 0.45,
          "from": 4,
          "to": 9
        }
      ],
      "sfx": [
        {
          "src": "assets/sfx/sample-whoosh.wav",
          "at": 0
        }
      ]
    },
    {
      "id": "catch",
      "duration": 20,
      "transition": {
        "type": "wipe",
        "duration": 0.5,
        "direction": "from-left"
      },
      "visual": {
        "type": "shot",
        "src": "shots/sample/h_m1_top.mp4",
        "trim": 0
      },
      "pip": {
        "src": "shots/sample/h_m1_mind.webm",
        "transparent": true,
        "corner": "top-right",
        "size": 0.34,
        "label": "Her belief map"
      },
      "overlays": [
        {
          "type": "lowerThird",
          "title": "The *catch*",
          "subtitle": "She was sure where I was before she could see me",
          "from": 2,
          "to": 9
        },
        {
          "type": "circle",
          "x": 0.5,
          "y": 0.5,
          "radius": 0.09,
          "from": 11,
          "to": 15
        }
      ],
      "sfx": [
        {
          "src": "assets/sfx/sample-boom.wav",
          "at": 12.6
        }
      ]
    },
    {
      "id": "loud",
      "duration": 12,
      "transition": {
        "type": "clock",
        "duration": 0.6
      },
      "visual": {
        "type": "shot",
        "src": "shots/sample/h_m2_orbit.mp4",
        "trim": 0
      },
      "overlays": [
        {
          "type": "meme",
          "template": "nobody",
          "text": "*…I heard that.*",
          "from": 3,
          "to": 9
        }
      ]
    },
    {
      "id": "near-misses",
      "duration": 12,
      "transition": {
        "type": "fade",
        "duration": 0.5
      },
      "visual": {
        "type": "split",
        "direction": "row",
        "a": {
          "type": "shot",
          "src": "shots/sample/h_m5_chase.mp4",
          "trim": 0,
          "label": "Near miss 1"
        },
        "b": {
          "type": "shot",
          "src": "shots/sample/h_m6_cctv.mp4",
          "trim": 0,
          "volume": 0,
          "label": "Near miss 2"
        }
      }
    },
    {
      "id": "still",
      "duration": 8,
      "transition": {
        "type": "fade",
        "duration": 0.5
      },
      "visual": {
        "type": "image",
        "src": "assets/images/sample-store.png",
        "zoom": [
          {
            "at": 0,
            "scale": 1.05,
            "x": 0.3,
            "y": 0.5
          },
          {
            "at": 8,
            "scale": 1.3,
            "x": 0.7,
            "y": 0.45
          }
        ]
      },
      "overlays": [
        {
          "type": "meme",
          "template": "caption-bar",
          "text": "Me, restocking cereal at 3 a.m., thinking I'm *alone*"
        },
        {
          "type": "gif",
          "src": "assets/gifs/sample-blink.gif",
          "x": 0.82,
          "y": 0.66,
          "width": 0.24,
          "from": 1.5
        }
      ]
    },
    {
      "id": "outro",
      "duration": 30,
      "transition": {
        "type": "slide",
        "duration": 0.5,
        "direction": "from-bottom"
      },
      "visual": {
        "type": "shot",
        "src": "shots/sample/h_outro_top.mp4",
        "trim": 0,
        "speed": 0.9,
        "volume": 0.5
      },
      "overlays": [
        {
          "type": "meme",
          "template": "top-bottom",
          "top": "Clocked in",
          "bottom": "Never *really* clocked out",
          "from": 18
        }
      ]
    }
  ],
  "voice": {
    "en": [
      {
        "src": "audio/sample/sample-long-shift.en.01.wav",
        "at": 0.8,
        "duration": 4.736,
        "speaker": "narrator",
        "words": [
          {
            "text": "This",
            "start": 0.012,
            "end": 0.274
          },
          {
            "text": "is",
            "start": 0.274,
            "end": 0.449
          },
          {
            "text": "Kehai.",
            "start": 0.449,
            "end": 0.81
          },
          {
            "text": "You",
            "start": 0.93,
            "end": 1.148
          },
          {
            "text": "work",
            "start": 1.148,
            "end": 1.411
          },
          {
            "text": "the",
            "start": 1.411,
            "end": 1.629
          },
          {
            "text": "night",
            "start": 1.629,
            "end": 1.935
          },
          {
            "text": "shift.",
            "start": 1.935,
            "end": 2.296
          },
          {
            "text": "Your",
            "start": 2.416,
            "end": 2.678
          },
          {
            "text": "manager,",
            "start": 2.678,
            "end": 3.127
          },
          {
            "text": "Aiko,",
            "start": 3.247,
            "end": 3.564
          },
          {
            "text": "is",
            "start": 3.684,
            "end": 3.859
          },
          {
            "text": "always",
            "start": 3.859,
            "end": 4.208
          },
          {
            "text": "there.",
            "start": 4.208,
            "end": 4.569
          }
        ]
      },
      {
        "src": "audio/sample/sample-long-shift.en.02.wav",
        "at": 6.5,
        "duration": 5.532,
        "speaker": "narrator",
        "words": [
          {
            "text": "By",
            "start": 0.01,
            "end": 0.184
          },
          {
            "text": "shift",
            "start": 0.184,
            "end": 0.488
          },
          {
            "text": "three,",
            "start": 0.488,
            "end": 0.845
          },
          {
            "text": "she",
            "start": 0.965,
            "end": 1.182
          },
          {
            "text": "has",
            "start": 1.182,
            "end": 1.399
          },
          {
            "text": "learned",
            "start": 1.399,
            "end": 1.79
          },
          {
            "text": "my",
            "start": 1.79,
            "end": 1.964
          },
          {
            "text": "route.",
            "start": 1.964,
            "end": 2.322
          },
          {
            "text": "She",
            "start": 2.442,
            "end": 2.659
          },
          {
            "text": "calls",
            "start": 2.659,
            "end": 2.963
          },
          {
            "text": "me",
            "start": 2.963,
            "end": 3.136
          },
          {
            "text": "over",
            "start": 3.136,
            "end": 3.397
          },
          {
            "text": "the",
            "start": 3.397,
            "end": 3.614
          },
          {
            "text": "PA,",
            "start": 3.614,
            "end": 3.841
          },
          {
            "text": "then",
            "start": 3.961,
            "end": 4.222
          },
          {
            "text": "she's",
            "start": 4.222,
            "end": 4.526
          },
          {